<?xml version="1.0" encoding="UTF-8"?>
<Students xmlns:xsi="http://www.w3.org/2001/XMLSchema-instance"
xsi:noNamespaceSchemaLocation="Students.xsd">
<Student>
<ID>1</ID>
<CNE>16851211</CNE>
<DateofBirth>2002-08-15</DateofBirth>
<FirstName>Lynch</FirstName>
<LastName>Knowles</LastName>
<ClasseName>AP2</ClasseName>
<Phone>01 27 66 52 31</Phone>
<Email>lobortis@eu.com</Email>
</Student>
<Student>
<ID>2</ID>
<CNE>16450123</CNE>
<DateofBirth>2002-06-02</DateofBirth>
<FirstName>Figueroa</FirstName>
<LastName>Gamble</LastName>
<ClasseName>AP2</ClasseName>
<Phone>08 91 85 71 49</Phone>
<Email>ut.dolor.dapibus@felis.net</Email>
</Student>
<Student>
<ID>3</ID>
<CNE>16130611</CNE>
<DateofBirth>2002-03-28</DateofBirth>
<FirstName>Craig</FirstName>
<LastName>Manning</LastName>
<ClasseName>AP2</ClasseName>
<Phone>02 14 98 65 04</Phone>
<Email>magna.Phasellus.dolor@necmetus.co.uk</Email>
</Student>
<Student>
<ID>4</ID>
<CNE>16790103</CNE>
<DateofBirth>2003-01-29</DateofBirth>
<FirstName>Mcdowell</FirstName>
<LastName>Byrd</LastName>
<ClasseName>AP2</ClasseName>
<Phone>02 95 39 28 92</Phone>
<Email>ipsum.ac.mi@dictum.co.uk</Email>
</Student>
<Student>
<ID>5</ID>
<CNE>16630215</CNE>
<DateofBirth>2002-10-10</DateofBirth>
<FirstName>Whitfield</FirstName>
<LastName>Woods</LastName>
<ClasseName>AP2</ClasseName>
<Phone>07 02 34 94 07</Phone>
<Email>dolor@lacinia.edu</Email>
</Student>
<Student>
<ID>6</ID>
<CNE>16950312</CNE>
<DateofBirth>2002-10-04</DateofBirth>
<FirstName>Colon</FirstName>
<LastName>Hartman</LastName>
<ClasseName>AP2</ClasseName>
<Phone>07 57 66 35 57</Phone>
<Email>nec.imperdiet.nec@arcuVestibulum.co.uk</Email>
</Student>
<Student>
<ID>7</ID>
<CNE>16990928</CNE>
<DateofBirth>2002-04-19</DateofBirth>
<FirstName>Sweeney</FirstName>
<LastName>Whitley</LastName>
<ClasseName>AP2</ClasseName>
<Phone>07 52 66 87 75</Phone>
<Email>nulla.vulputate@auctornuncnulla.net</Email>
</Student>
<Student>
<ID>8</ID>
<CNE>16430126</CNE>
<DateofBirth>2002-12-02</DateofBirth>
<FirstName>Dickson</FirstName>
<LastName>Cantrell</LastName>
<ClasseName>AP2</ClasseName>
<Phone>06 99 77 92 63</Phone>
<Email>Sed.molestie.Sed@sodalesnisimagna.com</Email>
</Student>
<Student>
<ID>9</ID>
<CNE>16510530</CNE>
<DateofBirth>2002-12-02</DateofBirth>
<FirstName>Johnson</FirstName>
<LastName>Kerr</LastName>
<ClasseName>AP2</ClasseName>
<Phone>07 36 84 75 89</Phone>
<Email>ultrices@nequeNullam.net</Email>
</Student>
<Student>
<ID>10</ID>
<CNE>16701206</CNE>
<DateofBirth>2002-09-25</DateofBirth>
<FirstName>Mcdowell</FirstName>
<LastName>Mccullough</LastName>
<ClasseName>AP2</ClasseName>
<Phone>04 66 70 93 99</Phone>
<Email>pede.ultrices@dictummi.com</Email>
</Student>
<Student>
<ID>11</ID>
<CNE>16160104</CNE>
<DateofBirth>2002-06-27</DateofBirth>
<FirstName>Tyson</FirstName>
<LastName>Mcintosh</LastName>
<ClasseName>AP2</ClasseName>
<Phone>07 89 99 82 58</Phone>
<Email>magna@accumsan.org</Email>
</Student>
<Student>
<ID>12</ID>
<CNE>16201127</CNE>
<DateofBirth>2002-08-20</DateofBirth>
<FirstName>Rose</FirstName>
<LastName>Villarreal</LastName>
<ClasseName>AP2</ClasseName>
<Phone>03 96 26 81 26</Phone>
<Email>orci.adipiscing.non@iaculislacus.org</Email>
</Student>
<Student>
<ID>13</ID>
<CNE>16610508</CNE>
<DateofBirth>2002-10-02</DateofBirth>
<FirstName>Reid</FirstName>
<LastName>Fisher</LastName>
<ClasseName>AP2</ClasseName>
<Phone>08 97 33 21 53</Phone>
<Email>ullamcorper.Duis@Inornare.org</Email>
</Student>
<Student>
<ID>14</ID>
<CNE>16691027</CNE>
<DateofBirth>2002-03-10</DateofBirth>
<FirstName>Glenn</FirstName>
<LastName>Thompson</LastName>
<ClasseName>AP2</ClasseName>
<Phone>07 16 40 37 32</Phone>
<Email>sit@Nullam.ca</Email>
</Student>
<Student>
<ID>15</ID>
<CNE>16500302</CNE>
<DateofBirth>2002-05-24</DateofBirth>
<FirstName>Gutierrez</FirstName>
<LastName>Coleman</LastName>
<ClasseName>AP2</ClasseName>
<Phone>02 02 85 10 47</Phone>
<Email>nonummy@orcitincidunt.ca</Email>
</Student>
<Student>
<ID>16</ID>
<CNE>16080714</CNE>
<DateofBirth>2002-07-12</DateofBirth>
<FirstName>Duncan</FirstName>
<LastName>Chambers</LastName>
<ClasseName>AP2</ClasseName>
<Phone>05 89 65 75 63</Phone>
<Email>eleifend@idlibero.net</Email>
</Student>
<Student>
<ID>17</ID>
<CNE>16910723</CNE>
<DateofBirth>2002-09-10</DateofBirth>
<FirstName>Strong</FirstName>
<LastName>Oconnor</LastName>
<ClasseName>AP2</ClasseName>
<Phone>03 12 31 58 90</Phone>
<Email>libero.Proin@lacuspedesagittis.co.uk</Email>
</Student>
<Student>
<ID>18</ID>
<CNE>16891209</CNE>
<DateofBirth>2002-03-16</DateofBirth>
<FirstName>Langley</FirstName>
<LastName>Mccullough</LastName>
<ClasseName>AP2</ClasseName>
<Phone>07 00 58 04 78</Phone>
<Email>consequat.lectus@porttitorscelerisqueneque.ca</Email>
</Student>
<Student>
<ID>19</ID>
<CNE>16250402</CNE>
<DateofBirth>2002-08-17</DateofBirth>
<FirstName>Durham</FirstName>
<LastName>Vaughan</LastName>
<ClasseName>AP2</ClasseName>
<Phone>03 06 37 96 17</Phone>
<Email>Donec@ipsum.co.uk</Email>
</Student>
<Student>
<ID>20</ID>
<CNE>16970209</CNE>
<DateofBirth>2002-12-01</DateofBirth>
<FirstName>Perry</FirstName>
<LastName>Levy</LastName>
<ClasseName>AP2</ClasseName>
<Phone>03 75 31 08 21</Phone>
<Email>nulla.Integer.urna@quis.org</Email>
</Student>
<Student>
<ID>21</ID>
<CNE>16660206</CNE>
<DateofBirth>2002-03-14</DateofBirth>
<FirstName>Lawrence</FirstName>
<LastName>Espinoza</LastName>
<ClasseName>AP2</ClasseName>
<Phone>09 30 21 59 83</Phone>
<Email>at@nuncnulla.net</Email>
</Student>
<Student>
<ID>22</ID>
<CNE>16930503</CNE>
<DateofBirth>2002-07-30</DateofBirth>
<FirstName>Freeman</FirstName>
<LastName>Vaughn</LastName>
<ClasseName>AP2</ClasseName>
<Phone>02 68 34 47 98</Phone>
<Email>Suspendisse@amet.co.uk</Email>
</Student>
<Student>
<ID>23</ID>
<CNE>16220706</CNE>
<DateofBirth>2002-11-29</DateofBirth>
<FirstName>Torres</FirstName>
<LastName>Parsons</LastName>
<ClasseName>AP2</ClasseName>
<Phone>04 47 92 51 70</Phone>
<Email>lobortis.tellus.justo@vel.com</Email>
</Student>
<Student>
<ID>24</ID>
<CNE>16590413</CNE>
<DateofBirth>2002-09-27</DateofBirth>
<FirstName>Gilbert</FirstName>
<LastName>Owen</LastName>
<ClasseName>AP2</ClasseName>
<Phone>04 73 34 12 35</Phone>
<Email>sagittis.lobortis@egestasDuis.co.uk</Email>
</Student>
<Student>
<ID>25</ID>
<CNE>16161018</CNE>
<DateofBirth>2002-08-05</DateofBirth>
<FirstName>Hodge</FirstName>
<LastName>Grant</LastName>
<ClasseName>AP2</ClasseName>
<Phone>04 89 81 94 11</Phone>
<Email>tempor@luctus.org</Email>
</Student>
<Student>
<ID>26</ID>
<CNE>16740317</CNE>
<DateofBirth>2002-10-04</DateofBirth>
<FirstName>Gibbs</FirstName>
<LastName>Parrish</LastName>
<ClasseName>AP2</ClasseName>
<Phone>07 13 43 96 72</Phone>
<Email>hendrerit@Donecfelisorci.com</Email>
</Student>
<Student>
<ID>27</ID>
<CNE>16421018</CNE>
<DateofBirth>2002-04-29</DateofBirth>
<FirstName>Hurst</FirstName>
<LastName>Alford</LastName>
<ClasseName>AP2</ClasseName>
<Phone>07 94 27 18 37</Phone>
<Email>semper.pretium.neque@Maurisquis.org</Email>
</Student>
<Student>
<ID>28</ID>
<CNE>16671008</CNE>
<DateofBirth>2002-06-11</DateofBirth>
<FirstName>Robertson</FirstName>
<LastName>Blake</LastName>
<ClasseName>AP2</ClasseName>
<Phone>09 39 17 51 30</Phone>
<Email>pede.Nunc.sed@magnaSuspendisse.edu</Email>
</Student>
<Student>
<ID>29</ID>
<CNE>16160813</CNE>
<DateofBirth>2002-07-07</DateofBirth>
<FirstName>George</FirstName>
<LastName>Harris</LastName>
<ClasseName>AP2</ClasseName>
<Phone>08 29 04 82 88</Phone>
<Email>euismod.enim.Etiam@eunibh.edu</Email>
</Student>
<Student>
<ID>30</ID>
<CNE>16860418</CNE>
<DateofBirth>2002-09-19</DateofBirth>
<FirstName>Mcpherson</FirstName>
<LastName>Cruz</LastName>
<ClasseName>AP2</ClasseName>
<Phone>04 44 63 23 62</Phone>
<Email>est@Aliquam.co.uk</Email>
</Student>
<Student>
<ID>31</ID>
<CNE>16270530</CNE>
<DateofBirth>2002-10-13</DateofBirth>
<FirstName>Calderon</FirstName>
<LastName>Whitehead</LastName>
<ClasseName>AP2</ClasseName>
<Phone>08 63 40 26 88</Phone>
<Email>Morbi.accumsan@nibh.edu</Email>
</Student>
<Student>
<ID>32</ID>
<CNE>16400221</CNE>
<DateofBirth>2002-08-15</DateofBirth>
<FirstName>Tyler</FirstName>
<LastName>Castillo</LastName>
<ClasseName>AP2</ClasseName>
<Phone>05 22 72 00 78</Phone>
<Email>arcu.Vestibulum.ante@pretiumnequeMorbi.net</Email>
</Student>
</Students>
